{
  "schema_version": 1,
  "artifact_type": "plan_review_manifest",
  "logical_plan_id": "peer-residue-2026-09-15",
  "minimum_distinct_families": 2,
  "max_attempts_per_seat": 2,
  "seats": [
    {
      "id": "glm_architecture",
      "runner": "anthropic-compatible",
      "model": "glm-5.2",
      "effort": "high",
      "endpoint": "glm",
      "role": "architecture-contract",
      "family": "zhipu",
      "readiness_status": "ready",
      "qualification_status": "qualified",
      "required": true,
      "excluded_families": [],
      "fallbacks": []
    },
    {
      "id": "minimax_operations_skeptic",
      "runner": "anthropic-compatible",
      "model": "MiniMax-M3",
      "effort": "high",
      "endpoint": "minimax",
      "role": "operations-skeptic",
      "family": "minimax",
      "readiness_status": "ready",
      "qualification_status": "qualified",
      "required": true,
      "excluded_families": [],
      "fallbacks": []
    }
  ]
}
